{
  "name": "robot_localization",
  "basic": {
    "ros_pkg": "robot_localization",
    "ros_node": "ekf_node"
  },
  "lifecycle": {
    "install_script": "install.sh",
    "verify_cmd": "bash -lc \"source /opt/ros/foxy/setup.bash; if [ -f /robofuzz/robot_localization_ws/install/setup.bash ]; then source /robofuzz/robot_localization_ws/install/setup.bash; fi; timeout 6s ros2 run robot_localization ekf_node --ros-args --params-file /opt/ros/foxy/share/robot_localization/params/ekf.yaml >/tmp/robot_localization_verify.log 2>&1; rc=\\$?; test \\$rc -eq 124\"",
    "skip_ros_pkg_check": false,
    "start_cmd": "bash -lc \"source /opt/ros/foxy/setup.bash; if [ -f /robofuzz/robot_localization_ws/install/setup.bash ]; then source /robofuzz/robot_localization_ws/install/setup.bash; fi; ros2 run robot_localization ekf_node --ros-args --params-file params/ekf.yaml\"",
    "stop_cmd": "pkill -f \"robot_localization.*ekf\" || true",
    "warmup_sec": 2.0,
    "exec_cmd": "true"
  },
  "fuzzing": {
    "default_topic": "/imu/data",
    "default_msg_type": "sensor_msgs/msg/Imu",
    "field_whitelist": [
      [
        "orientation",
        "x",
        "float64"
      ],
      [
        "orientation",
        "y",
        "float64"
      ],
      [
        "orientation",
        "z",
        "float64"
      ],
      [
        "orientation",
        "w",
        "float64"
      ],
      [
        "angular_velocity",
        "x",
        "float64"
      ],
      [
        "angular_velocity",
        "y",
        "float64"
      ],
      [
        "angular_velocity",
        "z",
        "float64"
      ],
      [
        "linear_acceleration",
        "x",
        "float64"
      ],
      [
        "linear_acceleration",
        "y",
        "float64"
      ],
      [
        "linear_acceleration",
        "z",
        "float64"
      ],
      [
        "header",
        "stamp",
        "sec",
        "uint32"
      ],
      [
        "header",
        "stamp",
        "nanosec",
        "uint32"
      ]
    ]
  },
  "monitoring": {
    "watchlist": "watchlist.json",
    "plugin": "plugin.py"
  }
}
