{
  "name": "px4_sitl_mav",
  "basic": {
    "ros_pkg": "px4",
    "ros_node": "drone"
  },
  "lifecycle": {
    "managed": false,
    "warmup_sec": 10.0
  },
  "fuzzing": {
    "default_topic": "/dummy_mavlink_topic",
    "default_msg_type": "px4_msgs/msg/ManualControlSetpoint",
    "field_whitelist": [
      ["x", "float32"],
      ["y", "float32"],
      ["z", "float32"],
      ["r", "float32"]
    ],
    "feedback": [
      {"name": "imu_accel_inconsistency", "type": "INC"},
      {"name": "imu_gyro_inconsistency", "type": "INC"},
      {"name": "gps_lat_inconsistency", "type": "INC"},
      {"name": "gps_lon_inconsistency", "type": "INC"}
    ]
  },
  "monitoring": {
    "watchlist": "../../watchlist/px4.json"
  },
  "runtime": {
    "px4_sitl": true,
    "px4_ros": false,
    "use_mavlink": true,
    "exp_pgfuzz": false,
    "flight_mode": "POSCTL"
  }
}
